[
  {
    "title": "A Game of Thrones",
    "author": "George R. R. Martin",
    "pages": 694,
    "id": 1
  },
  {
    "title": "A Clash of Kings",
    "author": "George R. R. Martin",
    "pages": 768,
    "id": 2
  },
  {
    "title": "A Storm of Swords",
    "author": "George R. R. Martin",
    "pages": 973,
    "id": 3
  },
  {
    "title": "A Feast for Crows",
    "author": "George R. R. Martin",
    "pages": 976,
    "id": 4
  },
  {
    "title": "A Dance with Dragons",
    "author": "George R. R. Martin",
    "pages": 1040,
    "id": 5
  },
  {
    "title": "The Silmarillion",
    "author": "J.R.R Tolkien",
    "pages": 365,
    "id": 6
  }
]